[
  {
    "vehicle_id": "lucid-air-pure-2026",
    "make": "Lucid",
    "model": "Air",
    "trim": "Pure RWD (19in wheels)",
    "model_year": 2026,
    "lineage_id": "lucid-air",
    "region": "US",
    "status": "unverified_availability",
    "status_checked_date": "2026-10-02"
  },
  {
    "vehicle_id": "tesla-model-y-premium-rwd-2026",
    "make": "Tesla",
    "model": "Model Y",
    "trim": "Premium RWD",
    "model_year": 2026,
    "lineage_id": "tesla-model-y",
    "region": "US",
    "status": "unverified_availability",
    "status_checked_date": "2026-10-02"
  },
  {
    "vehicle_id": "tesla-model-3-2026",
    "make": "Tesla",
    "model": "Model 3",
    "trim": "Standard RWD",
    "model_year": 2026,
    "lineage_id": "tesla-model-3",
    "region": "US",
    "status": "unverified_availability",
    "status_checked_date": "2026-10-02"
  },
  {
    "vehicle_id": "tesla-model-s-2026",
    "make": "Tesla",
    "model": "Model S",
    "trim": "AWD (non-Plaid)",
    "model_year": 2026,
    "lineage_id": "tesla-model-s",
    "region": "US",
    "status": "unverified_availability",
    "status_checked_date": "2026-10-02"
  },
  {
    "vehicle_id": "lucid-gravity-2026",
    "make": "Lucid",
    "model": "Gravity",
    "trim": "Touring (20in front / 21in rear wheels)",
    "model_year": 2026,
    "lineage_id": "lucid-gravity",
    "region": "US",
    "status": "unverified_availability",
    "status_checked_date": "2026-10-02"
  },
  {
    "vehicle_id": "rivian-r1t-2026",
    "make": "Rivian",
    "model": "R1T",
    "trim": "Dual Standard (20in wheels)",
    "model_year": 2026,
    "lineage_id": "rivian-r1",
    "region": "US",
    "status": "unverified_availability",
    "status_checked_date": "2026-10-02"
  },
  {
    "vehicle_id": "rivian-r2-2027",
    "make": "Rivian",
    "model": "R2",
    "trim": "Performance AWD (20in all-terrain wheels)",
    "model_year": 2027,
    "lineage_id": "rivian-r2",
    "region": "US",
    "status": "unverified_availability",
    "status_checked_date": "2026-10-02"
  },
  {
    "vehicle_id": "hyundai-ioniq5-2026",
    "make": "Hyundai",
    "model": "Ioniq 5",
    "trim": "Standard Range RWD",
    "model_year": 2026,
    "lineage_id": "hyundai-ioniq5",
    "region": "US",
    "status": "current",
    "status_checked_date": "2026-10-03"
  },
  {
    "vehicle_id": "hyundai-ioniq6-2025",
    "make": "Hyundai",
    "model": "Ioniq 6",
    "trim": "Standard Range",
    "model_year": 2025,
    "lineage_id": "hyundai-ioniq6",
    "region": "US",
    "status": "unverified_availability",
    "status_checked_date": "2026-10-02"
  },
  {
    "vehicle_id": "kia-ev6-2026",
    "make": "Kia",
    "model": "EV6",
    "trim": "Standard Range RWD",
    "model_year": 2026,
    "lineage_id": "kia-ev6",
    "region": "US",
    "status": "current",
    "status_checked_date": "2026-10-03"
  },
  {
    "vehicle_id": "porsche-taycan-2026",
    "make": "Porsche",
    "model": "Taycan",
    "trim": "Base (RWD, Performance Battery)",
    "model_year": 2026,
    "lineage_id": "porsche-taycan",
    "region": "US",
    "status": "unverified_availability",
    "status_checked_date": "2026-10-02"
  },
  {
    "vehicle_id": "chevrolet-equinox-ev-2026",
    "make": "Chevrolet",
    "model": "Equinox EV",
    "trim": "FWD",
    "model_year": 2026,
    "lineage_id": "chevrolet-equinox-ev",
    "region": "US",
    "status": "unverified_availability",
    "status_checked_date": "2026-10-02"
  },
  {
    "vehicle_id": "cadillac-lyriq-2026",
    "make": "Cadillac",
    "model": "Lyriq",
    "trim": "RWD (11 kW onboard charger)",
    "model_year": 2026,
    "lineage_id": "cadillac-lyriq",
    "region": "US",
    "status": "unverified_availability",
    "status_checked_date": "2026-10-02"
  },
  {
    "vehicle_id": "ford-mustang-mach-e-2026",
    "make": "Ford",
    "model": "Mustang Mach-E",
    "trim": "RWD (standard range)",
    "model_year": 2026,
    "lineage_id": "ford-mach-e",
    "region": "US",
    "status": "current",
    "status_checked_date": "2026-10-03"
  },
  {
    "vehicle_id": "vw-id4-2026",
    "make": "Volkswagen",
    "model": "ID.4",
    "trim": "RWD",
    "model_year": 2026,
    "lineage_id": "vw-id4",
    "region": "US",
    "status": "unverified_availability",
    "status_checked_date": "2026-10-02"
  },
  {
    "vehicle_id": "bmw-i4-2026",
    "make": "BMW",
    "model": "i4",
    "trim": "eDrive35 Gran Coupe (19in wheels)",
    "model_year": 2026,
    "lineage_id": "bmw-i4",
    "region": "US",
    "status": "unverified_availability",
    "status_checked_date": "2026-10-02"
  },
  {
    "vehicle_id": "mercedes-cla-electric-2026",
    "make": "Mercedes-Benz",
    "model": "CLA (electric)",
    "trim": "CLA 250+ with EQ Technology",
    "model_year": 2026,
    "lineage_id": "mercedes-cla-electric",
    "region": "US",
    "status": "unverified_availability",
    "status_checked_date": "2026-10-02"
  },
  {
    "vehicle_id": "nissan-leaf-2026",
    "make": "Nissan",
    "model": "Leaf",
    "trim": "75 kWh (18in steel wheels)",
    "model_year": 2026,
    "lineage_id": "nissan-leaf",
    "region": "US",
    "status": "current",
    "status_checked_date": "2026-10-03"
  },
  {
    "vehicle_id": "chevrolet-bolt-2027",
    "make": "Chevrolet",
    "model": "Bolt",
    "trim": "LT",
    "model_year": 2027,
    "lineage_id": "chevrolet-bolt",
    "region": "US",
    "status": "current",
    "status_checked_date": "2026-10-03"
  },
  {
    "vehicle_id": "volvo-ex30-2026",
    "make": "Volvo",
    "model": "EX30",
    "trim": "Single Motor Extended Range",
    "model_year": 2026,
    "lineage_id": "volvo-ex30",
    "region": "US",
    "status": "unverified_availability",
    "status_checked_date": "2026-10-02"
  },
  {
    "vehicle_id": "genesis-gv60-rwd-2026",
    "make": "Genesis",
    "model": "GV60",
    "trim": "RWD",
    "model_year": 2026,
    "lineage_id": "genesis-gv60",
    "region": "US",
    "status": "unverified_availability",
    "status_checked_date": "2026-10-02"
  },
  {
    "vehicle_id": "polestar-2-single-motor-2025",
    "make": "Polestar",
    "model": "2",
    "trim": "Single Motor (19in wheels)",
    "model_year": 2025,
    "lineage_id": "polestar-2",
    "region": "US",
    "status": "unverified_availability",
    "status_checked_date": "2026-10-02"
  },
  {
    "vehicle_id": "honda-prologue-fwd-2026",
    "make": "Honda",
    "model": "Prologue",
    "trim": "FWD",
    "model_year": 2026,
    "lineage_id": "honda-prologue",
    "region": "US",
    "status": "current",
    "status_checked_date": "2026-10-03"
  },
  {
    "vehicle_id": "bmw-ix3-50-xdrive-2027",
    "make": "BMW",
    "model": "iX3",
    "trim": "50 xDrive (20in all-season)",
    "model_year": 2027,
    "lineage_id": "bmw-ix3",
    "region": "US",
    "status": "unverified_availability",
    "status_checked_date": "2026-10-02"
  },
  {
    "vehicle_id": "toyota-bz-fwd-2026",
    "make": "Toyota",
    "model": "bZ",
    "trim": "FWD (energy capacity 200 Ah)",
    "model_year": 2026,
    "lineage_id": "toyota-bz",
    "region": "US",
    "status": "unverified_availability",
    "status_checked_date": "2026-10-02"
  },
  {
    "vehicle_id": "audi-q4-45-etron-2026",
    "make": "Audi",
    "model": "Q4 e-tron",
    "trim": "45",
    "model_year": 2026,
    "lineage_id": "audi-q4-etron",
    "region": "US",
    "status": "unverified_availability",
    "status_checked_date": "2026-10-02"
  },
  {
    "vehicle_id": "subaru-solterra-awd-2026",
    "make": "Subaru",
    "model": "Solterra",
    "trim": "Premium AWD",
    "model_year": 2026,
    "lineage_id": "subaru-solterra",
    "region": "US",
    "status": "unverified_availability",
    "status_checked_date": "2026-10-03"
  },
  {
    "vehicle_id": "jeep-wagoneer-s-awd-2026",
    "make": "Jeep",
    "model": "Wagoneer S",
    "trim": "AWD (Falken tire)",
    "model_year": 2026,
    "lineage_id": "jeep-wagoneer-s",
    "region": "US",
    "status": "unverified_availability",
    "status_checked_date": "2026-10-03"
  },
  {
    "vehicle_id": "lexus-rz-350e-fwd-2026",
    "make": "Lexus",
    "model": "RZ",
    "trim": "350e FWD (18in wheels)",
    "model_year": 2026,
    "lineage_id": "lexus-rz",
    "region": "US",
    "status": "unverified_availability",
    "status_checked_date": "2026-10-03"
  },
  {
    "vehicle_id": "gmc-sierra-ev-std-range-2026",
    "make": "GMC",
    "model": "Sierra EV",
    "trim": "Elevation Standard Range (11 kW charger)",
    "model_year": 2026,
    "lineage_id": "gmc-sierra-ev",
    "region": "US",
    "status": "unverified_availability",
    "status_checked_date": "2026-10-03"
  },
  {
    "vehicle_id": "mini-countryman-se-all4-2026",
    "make": "MINI",
    "model": "Countryman",
    "trim": "SE ALL4 (18in wheels)",
    "model_year": 2026,
    "lineage_id": "mini-countryman-se",
    "region": "US",
    "status": "unverified_availability",
    "status_checked_date": "2026-10-03"
  },
  {
    "vehicle_id": "dodge-charger-daytona-rt-awd-2026",
    "make": "Dodge",
    "model": "Charger Daytona",
    "trim": "R/T AWD (245/55ZR18)",
    "model_year": 2026,
    "lineage_id": "dodge-charger-daytona",
    "region": "US",
    "status": "unverified_availability",
    "status_checked_date": "2026-10-03"
  },
  {
    "vehicle_id": "acura-zdx-rwd-2026",
    "make": "Acura",
    "model": "ZDX",
    "trim": "RWD",
    "model_year": 2026,
    "lineage_id": "acura-zdx",
    "region": "US",
    "status": "discontinued",
    "status_checked_date": "2026-10-03"
  },
  {
    "vehicle_id": "ford-f150-lightning-sr-2025",
    "make": "Ford",
    "model": "F-150 Lightning",
    "trim": "4WD Standard Range",
    "model_year": 2025,
    "lineage_id": "ford-f150-lightning",
    "region": "US",
    "status": "unverified_availability",
    "status_checked_date": "2026-10-03"
  },
  {
    "vehicle_id": "kia-ev9-long-range-rwd-2026",
    "make": "Kia",
    "model": "EV9",
    "trim": "Light Long Range RWD",
    "model_year": 2026,
    "lineage_id": "kia-ev9",